{
  "id": "cmd_01J8R2B0G4L7RX8P5W6C9ZABDE",
  "channel": "channel.time",
  "identity": "idn_system_scheduler",
  "org_path": [
    "acme"
  ],
  "intent": {
    "raw": "weekly bottleneck report",
    "recognised": "report.bottlenecks"
  },
  "reply_to": {
    "channel": "channel.chat",
    "address": "room-management"
  },
  "received_at": "2026-09-15T06:00:00Z"
}
